id,conference,year,title,authors,abstract,score,url_link
CVPR-2023-506,cvpr,2023,Learning To Exploit Temporal Structure for Biomedical Vision-Language Processing,"Shruthi Bannur, Stephanie Hyland, Qianchu Liu, Fernando Pérez-García, Maximilian Ilse, Daniel C. Castro, Benedikt Boecking, Harshita Sharma, Kenza Bouzid, Anja Thieme, Anton Schwaighofer, Maria Wetscherek, Matthew P. Lungren, Aditya Nori, Javier Alvarez-Valle, Ozan Oktay","Self-supervised learning in vision--language processing (VLP) exploits semantic alignment between imaging and text modalities. Prior work in biomedical VLP has mostly relied on the alignment of single image and report pairs even though clinical notes commonly refer to prior images. This does not only introduce poor alignment between the modalities but also a missed opportunity to exploit rich self-supervision through existing temporal content in the data. In this work, we explicitly account for prior images and reports when available during both training and fine-tuning. Our approach, named BioViL-T, uses a CNN--Transformer hybrid multi-image encoder trained jointly with a text model. It is designed to be versatile to arising challenges such as pose variations and missing input images across time. The resulting model excels on downstream tasks both in single- and multi-image setups, achieving state-of-the-art (SOTA) performance on (I) progression classification, (II) phrase grounding, and (III) report generation, whilst offering consistent improvements on disease classification and sentence-similarity tasks. We release a novel multi-modal temporal benchmark dataset, CXR-T, to quantify the quality of vision--language representations in terms of temporal semantics. Our experimental results show the significant advantages of incorporating prior images and reports to make most use of the data.",True,https://openaccess.thecvf.com/content/CVPR2023/papers/Tejankar_Defending_Against_Patch-Based_Backdoor_Attacks_on_Self-Supervised_Learning_CVPR_2023_paper.pdf
CVPR-2023-630,cvpr,2023,Crowd3D: Towards Hundreds of People Reconstruction From a Single Image,"Hao Wen, Jing Huang, Huili Cui, Haozhe Lin, Yu-Kun Lai, Lu Fang, Kun Li","Image-based multi-person reconstruction in wide-field large scenes is critical for crowd analysis and security alert. However, existing methods cannot deal with large scenes containing hundreds of people, which encounter the challenges of large number of people, large variations in human scale, and complex spatial distribution. In this paper, we propose Crowd3D, the first framework to reconstruct the 3D poses, shapes and locations of hundreds of people with global consistency from a single large-scene image. The core of our approach is to convert the problem of complex crowd localization into pixel localization with the help of our newly defined concept, Human-scene Virtual Interaction Point (HVIP). To reconstruct the crowd with global consistency, we propose a progressive reconstruction network based on HVIP by pre-estimating a scene-level camera and a ground plane. To deal with a large number of persons and various human sizes, we also design an adaptive human-centric cropping scheme. Besides, we contribute a benchmark dataset, LargeCrowd, for crowd reconstruction in a large scene. Experimental results demonstrate the effectiveness of the proposed method. The code and the dataset are available at http://cic.tju.edu.cn/faculty/likun/projects/Crowd3D.",True,https://openaccess.thecvf.com/content/CVPR2023/papers/Zheng_EXIF_As_Language_Learning_Cross-Modal_Associations_Between_Images_and_Camera_CVPR_2023_paper.pdf
CVPR-2023-1713,cvpr,2023,OCELOT: Overlapped Cell on Tissue Dataset for Histopathology,"Jeongun Ryu, Aaron Valero Puche, JaeWoong Shin, Seonwook Park, Biagio Brattoli, Jinhee Lee, Wonkyung Jung, Soo Ick Cho, Kyunghyun Paeng, Chan-Young Ock, Donggeun Yoo, Sérgio Pereira","Cell detection is a fundamental task in computational pathology that can be used for extracting high-level medical information from whole-slide images. For accurate cell detection, pathologists often zoom out to understand the tissue-level structures and zoom in to classify cells based on their morphology and the surrounding context. However, there is a lack of efforts to reflect such behaviors by pathologists in the cell detection models, mainly due to the lack of datasets containing both cell and tissue annotations with overlapping regions. To overcome this limitation, we propose and publicly release OCELOT, a dataset purposely dedicated to the study of cell-tissue relationships for cell detection in histopathology. OCELOT provides overlapping cell and tissue annotations on images acquired from multiple organs. Within this setting, we also propose multi-task learning approaches that benefit from learning both cell and tissue tasks simultaneously. When compared against a model trained only for the cell detection task, our proposed approaches improve cell detection performance on 3 datasets: proposed OCELOT, public TIGER, and internal CARP datasets. On the OCELOT test set in particular, we show up to 6.79 improvement in F1-score. We believe the contributions of this paper, including the release of the OCELOT dataset at https://lunit-io.github.io/research/publications/ocelot are a crucial starting point toward the important research direction of incorporating cell-tissue relationships in computation pathology.",True,https://openaccess.thecvf.com/content/CVPR2023/papers/Hu_REVEAL_Retrieval-Augmented_Visual-Language_Pre-Training_With_Multi-Source_Multimodal_Knowledge_Memory_CVPR_2023_paper.pdf
CVPR-2023-2111,cvpr,2023,HairStep: Transfer Synthetic to Real Using Strand and Depth Maps for Single-View 3D Hair Modeling,"Yujian Zheng, Zirong Jin, Moran Li, Haibin Huang, Chongyang Ma, Shuguang Cui, Xiaoguang Han","In this work, we tackle the challenging problem of learning-based single-view 3D hair modeling. Due to the great difficulty of collecting paired real image and 3D hair data, using synthetic data to provide prior knowledge for real domain becomes a leading solution. This unfortunately introduces the challenge of domain gap. Due to the inherent difficulty of realistic hair rendering, existing methods typically use orientation maps instead of hair images as input to bridge the gap. We firmly think an intermediate representation is essential, but we argue that orientation map using the dominant filtering-based methods is sensitive to uncertain noise and far from a competent representation. Thus, we first raise this issue up and propose a novel intermediate representation, termed as HairStep, which consists of a strand map and a depth map. It is found that HairStep not only provides sufficient information for accurate 3D hair modeling, but also is feasible to be inferred from real images. Specifically, we collect a dataset of 1,250 portrait images with two types of annotations. A learning framework is further designed to transfer real images to the strand map and depth map. It is noted that, an extra bonus of our new dataset is the first quantitative metric for 3D hair modeling. Our experiments show that HairStep narrows the domain gap between synthetic and real and achieves state-of-the-art performance on single-view 3D hair reconstruction.",True,https://openaccess.thecvf.com/content/CVPR2023/papers/Xie_Toward_Stable_Interpretable_and_Lightweight_Hyperspectral_Super-Resolution_CVPR_2023_paper.pdf
CVPR-2023-1771,cvpr,2023,EXCALIBUR: Encouraging and Evaluating Embodied Exploration,"Hao Zhu, Raghav Kapoor, So Yeon Min, Winson Han, Jiatai Li, Kaiwen Geng, Graham Neubig, Yonatan Bisk, Aniruddha Kembhavi, Luca Weihs","Experience precedes understanding. Humans constantly explore and learn about their environment out of curiosity, gather information, and update their models of the world. On the other hand, machines are either trained to learn passively from static and fixed datasets, or taught to complete specific goal-conditioned tasks. To encourage the development of exploratory interactive agents, we present the EXCALIBUR benchmark. EXCALIBUR allows agents to explore their environment for long durations and then query their understanding of the physical world via inquiries like: ""is the small heavy red bowl made from glass?"" or ""is there a silver spoon heavier than the egg?"". This design encourages agents to perform free-form home exploration without myopia induced by goal conditioning. Once the agents have answered a series of questions, they can renter the scene to refine their knowledge, update their beliefs, and improve their performance on the questions. Our experiments demonstrate the challenges posed by this dataset for the present-day state-of-the-art embodied systems and the headroom afforded to develop new innovative methods. Finally, we present a virtual reality interface that enables humans to seamlessly interact within the simulated world and use it to gather human performance measures. EXCALIBUR affords unique challenges in comparison to present-day benchmarks and represents the next frontier for embodied AI research.",True,https://openaccess.thecvf.com/content/CVPR2023/papers/Chrysos_Regularization_of_Polynomial_Networks_for_Image_Recognition_CVPR_2023_paper.pdf
CVPR-2023-2336,CVPR,2023,An Image Quality Assessment Dataset for Portraits,"Nicolas Chahine, Stefania Calarasanu, Davide Garcia-Civiero, Théo Cayla, Sira Ferradans, Jean Ponce","Year after year, the demand for ever-better smartphone photos continues to grow, in particular in the domain of portrait photography. Manufacturers thus use perceptual quality criteria throughout the development of smartphone cameras. This costly procedure can be partially replaced by automated learning-based methods for image quality assessment (IQA). Due to its subjective nature, it is necessary to estimate and guarantee the consistency of the IQA process, a characteristic lacking in the mean opinion scores (MOS) widely used for crowdsourcing IQA. In addition, existing blind IQA (BIQA) datasets pay little attention to the difficulty of cross-content assessment, which may degrade the quality of annotations. This paper introduces PIQ23, a portrait-specific IQA dataset of 5116 images of 50 predefined scenarios acquired by 100 smartphones, covering a high variety of brands, models, and use cases. The dataset includes individuals of various genders and ethnicities who have given explicit and informed consent for their photographs to be used in public research. It is annotated by pairwise comparisons (PWC) collected from over 30 image quality experts for three image attributes: face detail preservation, face target exposure, and overall image quality. An in-depth statistical analysis of these annotations allows us to evaluate their consistency over PIQ23. Finally, we show through an extensive comparison with existing baselines that semantic information (image context) can be used to improve IQA predictions.",True,https://openaccess.thecvf.com/content/CVPR2023/papers/Fu_You_Do_Not_Need_Additional_Priors_or_Regularizers_in_Retinex-Based_CVPR_2023_paper.pdf
CVPR-2023-2176,cvpr,2023,3D Video Loops From Asynchronous Input,"Li Ma, Xiaoyu Li, Jing Liao, Pedro V. Sander","Looping videos are short video clips that can be looped endlessly without visible seams or artifacts. They provide a very attractive way to capture the dynamism of natural scenes. Existing methods have been mostly limited to 2D representations. In this paper, we take a step forward and propose a practical solution that enables an immersive experience on dynamic 3D looping scenes. The key challenge is to consider the per-view looping conditions from asynchronous input while maintaining view consistency for the 3D representation. We propose a novel sparse 3D video representation, namely Multi-Tile Video (MTV), which not only provides a view-consistent prior, but also greatly reduces memory usage, making the optimization of a 4D volume tractable. Then, we introduce a two-stage pipeline to construct the 3D looping MTV from completely asynchronous multi-view videos with no time overlap. A novel looping loss based on video temporal retargeting algorithms is adopted during the optimization to loop the 3D scene. Experiments of our framework have shown promise in successfully generating and rendering photorealistic 3D looping videos in real time even on mobile devices. The code, dataset, and live demos are available in https://limacv.github.io/VideoLoop3D_web/.",True,https://openaccess.thecvf.com/content/CVPR2023/papers/Wang_Turning_Strengths_Into_Weaknesses_A_Certified_Robustness_Inspired_Attack_Framework_CVPR_2023_paper.pdf
CVPR-2023-2210,cvpr,2023,"Scalable, Detailed and Mask-Free Universal Photometric Stereo",Satoshi Ikehata,"In this paper, we introduce SDM-UniPS, a groundbreaking Scalable, Detailed, Mask-free, and Universal Photometric Stereo network. Our approach can recover astonishingly intricate surface normal maps, rivaling the quality of 3D scanners, even when images are captured under unknown, spatially-varying lighting conditions in uncontrolled environments. We have extended previous universal photometric stereo networks to extract spatial-light features, utilizing all available information in high-resolution input images and accounting for non-local interactions among surface points. Moreover, we present a new synthetic training dataset that encompasses a diverse range of shapes, materials, and illumination scenarios found in real-world scenes. Through extensive evaluation, we demonstrate that our method not only surpasses calibrated, lighting-specific techniques on public benchmarks, but also excels with a significantly smaller number of input images even without object masks.",True,https://openaccess.thecvf.com/content/CVPR2023/papers/Zhang_UniDAformer_Unified_Domain_Adaptive_Panoptic_Segmentation_Transformer_via_Hierarchical_Mask_CVPR_2023_paper.pdf
CVPR-2023-1354,cvpr,2023,Blur Interpolation Transformer for Real-World Motion From Blur,"Zhihang Zhong, Mingdeng Cao, Xiang Ji, Yinqiang Zheng, Imari Sato","This paper studies the challenging problem of recovering motion from blur, also known as joint deblurring and interpolation or blur temporal super-resolution. The challenges are twofold: 1) the current methods still leave considerable room for improvement in terms of visual quality even on the synthetic dataset, and 2) poor generalization to real-world data. To this end, we propose a blur interpolation transformer (BiT) to effectively unravel the underlying temporal correlation encoded in blur. Based on multi-scale residual Swin transformer blocks, we introduce dual-end temporal supervision and temporally symmetric ensembling strategies to generate effective features for time-varying motion rendering. In addition, we design a hybrid camera system to collect the first real-world dataset of one-to-many blur-sharp video pairs. Experimental results show that BiT has a significant gain over the state-of-the-art methods on the public dataset Adobe240. Besides, the proposed real-world dataset effectively helps the model generalize well to real blurry scenarios. Code and data are available at https://github.com/zzh-tech/BiT.",True,https://openaccess.thecvf.com/content/CVPR2023/papers/Wang_Multi-Agent_Automated_Machine_Learning_CVPR_2023_paper.pdf
CVPR-2023-1364,cvpr,2023,Iterative Next Boundary Detection for Instance Segmentation of Tree Rings in Microscopy Images of Shrub Cross Sections,"Alexander Gillert, Giulia Resente, Alba Anadon-Rosell, Martin Wilmking, Uwe Freiherr von Lukas","We address the problem of detecting tree rings in microscopy images of shrub cross sections. This can be regarded as a special case of the instance segmentation task with several unique challenges such as the concentric circular ring shape of the objects and high precision requirements that result in inadequate performance of existing methods. We propose a new iterative method which we term Iterative Next Boundary Detection (INBD). It intuitively models the natural growth direction, starting from the center of the shrub cross section and detecting the next ring boundary in each iteration step. In our experiments, INBD shows superior performance to generic instance segmentation methods and is the only one with a built-in notion of chronological order. Our dataset and source code are available at http://github.com/alexander-g/INBD.",True,https://openaccess.thecvf.com/content/CVPR2023/papers/Tian_Multi-Object_Manipulation_via_Object-Centric_Neural_Scattering_Functions_CVPR_2023_paper.pdf
CVPR-2023-992,cvpr,2023,Collaborative Noisy Label Cleaner: Learning Scene-Aware Trailers for Multi-Modal Highlight Detection in Movies,"Bei Gan, Xiujun Shu, Ruizhi Qiao, Haoqian Wu, Keyu Chen, Hanjun Li, Bo Ren","Movie highlights stand out of the screenplay for efficient browsing and play a crucial role on social media platforms. Based on existing efforts, this work has two observations: (1) For different annotators, labeling highlight has uncertainty, which leads to inaccurate and time-consuming annotations. (2) Besides previous supervised or unsupervised settings, some existing video corpora can be useful, e.g., trailers, but they are often noisy and incomplete to cover the full highlights. In this work, we study a more practical and promising setting, i.e., reformulating highlight detection as ""learning with noisy labels"". This setting does not require time-consuming manual annotations and can fully utilize existing abundant video corpora. First, based on movie trailers, we leverage scene segmentation to obtain complete shots, which are regarded as noisy labels. Then, we propose a Collaborative noisy Label Cleaner (CLC) framework to learn from noisy highlight moments. CLC consists of two modules: augmented cross-propagation (ACP) and multi-modality cleaning (MMC). The former aims to exploit the closely related audio-visual signals and fuse them to learn unified multi-modal representations. The latter aims to achieve cleaner highlight labels by observing the changes in losses among different modalities. To verify the effectiveness of CLC, we further collect a large-scale highlight dataset named MovieLights. Comprehensive experiments on MovieLights and YouTube Highlights datasets demonstrate the effectiveness of our approach. Code has been made available at: https://github.com/TencentYoutuResearch/HighlightDetection-CLC",True,https://openaccess.thecvf.com/content/CVPR2023/papers/Tukra_Improving_Visual_Representation_Learning_Through_Perceptual_Understanding_CVPR_2023_paper.pdf
CVPR-2023-1461,cvpr,2023,CelebV-Text: A Large-Scale Facial Text-Video Dataset,"Jianhui Yu, Hao Zhu, Liming Jiang, Chen Change Loy, Weidong Cai, Wayne Wu","Text-driven generation models are flourishing in video generation and editing. However, face-centric text-to-video generation remains a challenge due to the lack of a suitable dataset containing high-quality videos and highly relevant texts. This paper presents CelebV-Text, a large-scale, diverse, and high-quality dataset of facial text-video pairs, to facilitate research on facial text-to-video generation tasks. CelebV-Text comprises 70,000 in-the-wild face video clips with diverse visual content, each paired with 20 texts generated using the proposed semi-automatic text generation strategy. The provided texts are of high quality, describing both static and dynamic attributes precisely. The superiority of CelebV-Text over other datasets is demonstrated via comprehensive statistical analysis of the videos, texts, and text-video relevance. The effectiveness and potential of CelebV-Text are further shown through extensive self-evaluation. A benchmark is constructed with representative methods to standardize the evaluation of the facial text-to-video generation task. All data and models are publicly available.",True,https://openaccess.thecvf.com/content/CVPR2023/papers/Bian_NoPe-NeRF_Optimising_Neural_Radiance_Field_With_No_Pose_Prior_CVPR_2023_paper.pdf
CVPR-2023-576,cvpr,2023,OrienterNet: Visual Localization in 2D Public Maps With Neural Matching,"Paul-Edouard Sarlin, Daniel DeTone, Tsun-Yi Yang, Armen Avetisyan, Julian Straub, Tomasz Malisiewicz, Samuel Rota Bulò, Richard Newcombe, Peter Kontschieder, Vasileios Balntas","Humans can orient themselves in their 3D environments using simple 2D maps. Differently, algorithms for visual localization mostly rely on complex 3D point clouds that are expensive to build, store, and maintain over time. We bridge this gap by introducing OrienterNet, the first deep neural network that can localize an image with sub-meter accuracy using the same 2D semantic maps that humans use. OrienterNet estimates the location and orientation of a query image by matching a neural Bird's-Eye View with open and globally available maps from OpenStreetMap, enabling anyone to localize anywhere such maps are available. OrienterNet is supervised only by camera poses but learns to perform semantic matching with a wide range of map elements in an end-to-end manner. To enable this, we introduce a large crowd-sourced dataset of images captured across 12 cities from the diverse viewpoints of cars, bikes, and pedestrians. OrienterNet generalizes to new datasets and pushes the state of the art in both robotics and AR scenarios. The code is available at https://github.com/facebookresearch/OrienterNet",True,https://openaccess.thecvf.com/content/CVPR2023/papers/Qi_Diverse_3D_Hand_Gesture_Prediction_From_Body_Dynamics_by_Bilateral_CVPR_2023_paper.pdf
CVPR-2023-834,cvpr,2023,Multi-Granularity Archaeological Dating of Chinese Bronze Dings Based on a Knowledge-Guided Relation Graph,"Rixin Zhou, Jiafu Wei, Qian Zhang, Ruihua Qi, Xi Yang, Chuntao Li","The archaeological dating of bronze dings has played a critical role in the study of ancient Chinese history. Current archaeology depends on trained experts to carry out bronze dating, which is time-consuming and labor-intensive. For such dating, in this study, we propose a learning-based approach to integrate advanced deep learning techniques and archaeological knowledge. To achieve this, we first collect a large-scale image dataset of bronze dings, which contains richer attribute information than other existing fine-grained datasets. Second, we introduce a multihead classifier and a knowledge-guided relation graph to mine the relationship between attributes and the ding era. Third, we conduct comparison experiments with various existing methods, the results of which show that our dating method achieves a state-of-the-art performance. We hope that our data and applied networks will enrich fine-grained classification research relevant to other interdisciplinary areas of expertise. The dataset and source code used are included in our supplementary materials, and will be open after submission owing to the anonymity policy. Source codes and data are available at: https://github.com/zhourixin/bronze-Ding.",True,https://openaccess.thecvf.com/content/CVPR2023/papers/Kalluri_GeoNet_Benchmarking_Unsupervised_Adaptation_Across_Geographies_CVPR_2023_paper.pdf
CVPR-2023-481,cvpr,2023,Generating Aligned Pseudo-Supervision From Non-Aligned Data for Image Restoration in Under-Display Camera,"Ruicheng Feng, Chongyi Li, Huaijin Chen, Shuai Li, Jinwei Gu, Chen Change Loy","Due to the difficulty in collecting large-scale and perfectly aligned paired training data for Under-Display Camera (UDC) image restoration, previous methods resort to monitor-based image systems or simulation-based methods, sacrificing the realness of the data and introducing domain gaps. In this work, we revisit the classic stereo setup for training data collection -- capturing two images of the same scene with one UDC and one standard camera. The key idea is to ""copy"" details from a high-quality reference image and ""paste"" them on the UDC image. While being able to generate real training pairs, this setting is susceptible to spatial misalignment due to perspective and depth of field changes. The problem is further compounded by the large domain discrepancy between the UDC and normal images, which is unique to UDC restoration. In this paper, we mitigate the non-trivial domain discrepancy and spatial misalignment through a novel Transformer-based framework that generates well-aligned yet high-quality target data for the corresponding UDC input. This is made possible through two carefully designed components, namely, the Domain Alignment Module (DAM) and Geometric Alignment Module (GAM), which encourage robust and accurate discovery of correspondence between the UDC and normal views. Extensive experiments show that high-quality and well-aligned pseudo UDC training pairs are beneficial for training a robust restoration network. Code and the dataset are available at https://github.com/jnjaby/AlignFormer.",True,https://openaccess.thecvf.com/content/CVPR2023/papers/Zhang_Decoupling_MaxLogit_for_Out-of-Distribution_Detection_CVPR_2023_paper.pdf
