id,conference,year,title,authors,abstract,score,url_link
CVPR-2024-755,cvpr,2024,DSL-FIQA: Assessing Facial Image Quality via Dual-Set Degradation Learning and Landmark-Guided Transformer,"Wei-Ting Chen, Gurunandan Krishnan, Qiang Gao, Sy-Yen Kuo, Sizhou Ma, Jian Wang",Generic Face Image Quality Assessment (GFIQA) evaluates the perceptual quality of facial images which is crucial in improving image restoration algorithms and selecting high-quality face images for downstream tasks. We present a novel transformer-based method for GFIQA which is aided by two unique mechanisms. First a novel Dual-Set Degradation Representation Learning (DSL) mechanism uses facial images with both synthetic and real degradations to decouple degradation from content ensuring generalizability to real-world scenarios. This self-supervised method learns degradation features on a global scale providing a robust alternative to conventional methods that use local patch information in degradation learning. Second our transformer leverages facial landmarks to emphasize visually salient parts of a face image in evaluating its perceptual quality. We also introduce a balanced and diverse Comprehensive Generic Face IQA (CGFIQA-40k) dataset of 40K images carefully designed to overcome the biases in particular the imbalances in skin tone and gender representation in existing datasets. Extensive analysis and evaluation demonstrate the robustness of our method marking a significant improvement over prior methods.,True,https://openaccess.thecvf.com/content/CVPR2024/papers/Liu_End-to-End_Temporal_Action_Detection_with_1B_Parameters_Across_1000_Frames_CVPR_2024_paper.pdf
CVPR-2024-708,cvpr,2024,OmniMedVQA: A New Large-Scale Comprehensive Evaluation Benchmark for Medical LVLM,"Yutao Hu, Tianbin Li, Quanfeng Lu, Wenqi Shao, Junjun He, Yu Qiao, Ping Luo",Large Vision-Language Models (LVLMs) have demonstrated remarkable capabilities in various multimodal tasks. However their potential in the medical domain remains largely unexplored. A significant challenge arises from the scarcity of diverse medical images spanning various modalities and anatomical regions which is essential in real-world medical applications. To solve this problem in this paper we introduce OmniMedVQA a novel comprehensive medical Visual Question Answering (VQA) benchmark. This benchmark is collected from 73 different medical datasets including 12 different modalities and covering more than 20 distinct anatomical regions. Importantly all images in this benchmark are sourced from authentic medical scenarios ensuring alignment with the requirements of the medical field and suitability for evaluating LVLMs. Through our extensive experiments we have found that existing LVLMs struggle to address these medical VQA problems effectively. Moreover what surprises us is that medical-specialized LVLMs even exhibit inferior performance to those general-domain models calling for a more versatile and robust LVLM in the biomedical field. The evaluation results not only reveal the current limitations of LVLM in understanding real medical images but also highlight our dataset's significance. Our code with dataset are available at https://github.com/OpenGVLab/Multi-Modality-Arena.,True,https://openaccess.thecvf.com/content/CVPR2024/papers/Chen_Each_Test_Image_Deserves_A_Specific_Prompt_Continual_Test-Time_Adaptation_CVPR_2024_paper.pdf
CVPR-2024-210,cvpr,2024,Learning to Count without Annotations,"Lukas Knobel, Tengda Han, Yuki M. Asano","While recent supervised methods for reference-based object counting continue to improve the performance on benchmark datasets they have to rely on small datasets due to the cost associated with manually annotating dozens of objects in images. We propose UnCounTR a model that can learn this task without requiring any manual annotations. To this end we construct ""Self-Collages"" images with various pasted objects as training samples that provide a rich learning signal covering arbitrary object types and counts. Our method builds on existing unsupervised representations and segmentation techniques to successfully demonstrate for the first time the ability of reference-based counting without manual supervision. Our experiments show that our method not only outperforms simple baselines and generic models such as FasterRCNN and DETR but also matches the performance of supervised counting models in some domains.",True,https://openaccess.thecvf.com/content/CVPR2024/papers/Parihar_Balancing_Act_Distribution-Guided_Debiasing_in_Diffusion_Models_CVPR_2024_paper.pdf
CVPR-2024-1277,cvpr,2024,DanceCamera3D: 3D Camera Movement Synthesis with Music and Dance,"Zixuan Wang, Jia Jia, Shikun Sun, Haozhe Wu, Rong Han, Zhenyu Li, Di Tang, Jiaqing Zhou, Jiebo Luo",Choreographers determine what the dances look like while cameramen determine the final presentation of dances. Recently various methods and datasets have showcased the feasibility of dance synthesis. However camera movement synthesis with music and dance remains an unsolved challenging problem due to the scarcity of paired data. Thus we present DCM a new multi-modal 3D dataset which for the first time combines camera movement with dance motion and music audio. This dataset encompasses 108 dance sequences (3.2 hours) of paired dance-camera-music data from the anime community covering 4 music genres. With this dataset we uncover that dance camera movement is multifaceted and human-centric and possesses multiple influencing factors making dance camera synthesis a more challenging task compared to camera or dance synthesis alone. To overcome these difficulties we propose DanceCamera3D a transformer-based diffusion model that incorporates a novel body attention loss and a condition separation strategy. For evaluation we devise new metrics measuring camera movement quality diversity and dancer fidelity. Utilizing these metrics we conduct extensive experiments on our DCM dataset providing both quantitative and qualitative evidence showcasing the effectiveness of our DanceCamera3D model. Code and video demos are available at https://github.com/ Carmenw1203/DanceCamera3D-Official.,True,https://openaccess.thecvf.com/content/CVPR2024/papers/Chen_LEAP-VO_Long-term_Effective_Any_Point_Tracking_for_Visual_Odometry_CVPR_2024_paper.pdf
CVPR-2024-412,cvpr,2024,Point-VOS: Pointing Up Video Object Segmentation,"Sabarinath Mahadevan, Idil Esen Zulfikar, Paul Voigtlaender, Bastian Leibe",Current state-of-the-art Video Object Segmentation (VOS) methods rely on dense per-object mask annotations both during training and testing. This requires time-consuming and costly video annotation mechanisms. We propose a novel Point-VOS task with a spatio-temporally sparse point-wise annotation scheme that substantially reduces the annotation effort. We apply our annotation scheme to two large-scale video datasets with text descriptions and annotate over 19M points across 133K objects in 32K videos. Based on our annotations we propose a new Point-VOS benchmark and a corresponding point-based training mechanism which we use to establish strong baseline results. We show that existing VOS methods can easily be adapted to leverage our point annotations during training and can achieve results close to the fully-supervised performance when trained on pseudo-masks generated from these points. In addition we show that our data can be used to improve models that connect vision and language by evaluating it on the Video Narrative Grounding (VNG) task. We will make our code and annotations available at https://pointvos.github.io.,True,https://openaccess.thecvf.com/content/CVPR2024/papers/Ma_Constructing_and_Exploring_Intermediate_Domains_in_Mixed_Domain_Semi-supervised_Medical_CVPR_2024_paper.pdf
CVPR-2024-1547,cvpr,2024,Polos: Multimodal Metric Learning from Human Feedback for Image Captioning,"Yuiga Wada, Kanta Kaneda, Daichi Saito, Komei Sugiura",Establishing an automatic evaluation metric that closely aligns with human judgments is essential for effectively developing image captioning models. Recent data-driven metrics have demonstrated a stronger correlation with human judgments than classic metrics such as CIDEr; however they lack sufficient capabilities to handle hallucinations and generalize across diverse images and texts partially because they compute scalar similarities merely using embeddings learned from tasks unrelated to image captioning evaluation. In this study we propose Polos a supervised automatic evaluation metric for image captioning models. Polos computes scores from multimodal inputs using a parallel feature extraction mechanism that leverages embeddings trained through large-scale contrastive learning. To train Polos we introduce Multimodal Metric Learning from Human Feedback (M2LHF) a framework for developing metrics based on human feedback. We constructed the Polaris dataset which comprises 131K human judgments from 550 evaluators which is approximately ten times larger than standard datasets. Our approach achieved state-of-the-art performance on Composite Flickr8K-Expert Flickr8K-CF PASCAL-50S FOIL and the Polaris dataset thereby demonstrating its effectiveness and robustness.,True,https://openaccess.thecvf.com/content/CVPR2024/papers/Wu_Mitigating_Object_Dependencies_Improving_Point_Cloud_Self-Supervised_Learning_through_Object_CVPR_2024_paper.pdf
CVPR-2024-415,cvpr,2024,Towards Co-Evaluation of Cameras HDR and Algorithms for Industrial-Grade 6DoF Pose Estimation,"Agastya Kalra, Guy Stoppi, Dmitrii Marin, Vage Taamazyan, Aarrushi Shandilya, Rishav Agarwal, Anton Boykov, Tze Hao Chong, Michael Stark",6DoF Pose estimation has been gaining increased importance in vision for over a decade however it does not yet meet the reliability and accuracy standards for mass deployment in industrial robotics. To this effect we present the Industrial Plenoptic Dataset (IPD): the first dataset for the co-evaluation of cameras HDR and algorithms targeted at reliable high-accuracy industrial automation. Specifically we capture 2300 physical scenes of 20 industrial parts covering a 1mx1mx0.5m working volume resulting in over 100000 distinct object views. Each scene is captured with 13 well-calibrated multi-modal cameras including polarization and high-resolution structured light. In terms of lighting we capture each scene at 4 exposures and in 3 challenging lighting conditions ranging from 100 lux to 100000 lux. We also present validate and analyze robot consistency an evaluation method targeted at scalable high accuracy evaluation. We hope that vision systems that succeed on this dataset will have direct industry impact. The dataset and evaluation code are available at https://github.com/intrinsic-ai/ipd.,True,https://openaccess.thecvf.com/content/CVPR2024/papers/Shao_Context-Aware_Integration_of_Language_and_Visual_References_for_Natural_Language_CVPR_2024_paper.pdf
CVPR-2024-883,cvpr,2024,COCONut: Modernizing COCO Segmentation,"Xueqing Deng, Qihang Yu, Peng Wang, Xiaohui Shen, Liang-Chieh Chen",In recent decades the vision community has witnessed remarkable progress in visual recognition partially owing to advancements in dataset benchmarks. Notably the established COCO benchmark has propelled the development of modern detection and segmentation systems. However the COCO segmentation benchmark has seen comparatively slow improvement over the last decade. Originally equipped with coarse polygon annotations for thing instances it gradually incorporated coarse superpixel annotations for stuff regions which were subsequently heuristically amalgamated to yield panoptic segmentation annotations. These annotations executed by different groups of raters have resulted not only in coarse segmentation masks but also in inconsistencies between segmentation types. In this study we undertake a comprehensive reevaluation of the COCO segmentation annotations. By enhancing the annotation quality and expanding the dataset to encompass 383K images with more than 5.18M panoptic masks we introduce COCONut the COCO Next Universal segmenTation dataset. COCONut harmonizes segmentation annotations across semantic instance and panoptic segmentation with meticulously crafted high-quality masks and establishes a robust benchmark for all segmentation tasks. To our knowledge COCONut stands as the inaugural large-scale universal segmentation dataset verified by human raters. We anticipate that the release of COCONut will significantly contribute to the community's ability to assess the progress of novel neural networks.,True,https://openaccess.thecvf.com/content/CVPR2024/papers/Hwang_FlowerFormer_Empowering_Neural_Architecture_Encoding_using_a_Flow-aware_Graph_Transformer_CVPR_2024_paper.pdf
CVPR-2024-74,cvpr,2024,SatSynth: Augmenting Image-Mask Pairs through Diffusion Models for Aerial Semantic Segmentation,"Aysim Toker, Marvin Eisenberger, Daniel Cremers, Laura Leal-Taixé",In recent years semantic segmentation has become a pivotal tool in processing and interpreting satellite imagery. Yet a prevalent limitation of supervised learning techniques remains the need for extensive manual annotations by experts. In this work we explore the potential of generative image diffusion to address the scarcity of annotated data in earth observation tasks. The main idea is to learn the joint data manifold of images and labels leveraging recent advancements in denoising diffusion probabilistic models. To the best of our knowledge we are the first to generate both images and corresponding masks for satellite segmentation. We find that the obtained pairs not only display high quality in fine-scale features but also ensure a wide sampling diversity. Both aspects are crucial for earth observation data where semantic classes can vary severely in scale and occurrence frequency. We employ the novel data instances for downstream segmentation as a form of data augmentation. In our experiments we provide comparisons to prior works based on discriminative diffusion models or GANs. We demonstrate that integrating generated samples yields significant quantitative improvements for satellite semantic segmentation -- both compared to baselines and when training only on the original data.,True,https://openaccess.thecvf.com/content/CVPR2024/papers/Norouzi_ALGM_Adaptive_Local-then-Global_Token_Merging_for_Efficient_Semantic_Segmentation_with_CVPR_2024_paper.pdf
CVPR-2024-2336,cvpr,2024,Generalized Large-Scale Data Condensation via Various Backbone and Statistical Matching,"Shitong Shao, Zeyuan Yin, Muxin Zhou, Xindong Zhang, Zhiqiang Shen","The lightweight ""local-match-global"" matching introduced by SRe2L successfully creates a distilled dataset with comprehensive information on the full 224x224 ImageNet-1k. However this one-sided approach is limited to a particular backbone layer and statistics which limits the improvement of the generalization of a distilled dataset. We suggest that sufficient and various ""local-match-global"" matching are more precise and effective than a single one and has the ability to create a distilled dataset with richer information and better generalization. We call this perspective ""generalized matching"" and propose Generalized Various Backbone and Statistical Matching (G-VBSM) in this work which aims to create a synthetic dataset with densities ensuring consistency with the complete dataset across various backbones layers and statistics. As experimentally demonstrated G-VBSM is the first algorithm to obtain strong performance across both small-scale and large-scale datasets. Specifically G-VBSM achieves a performance of 38.7% on CIFAR-100 with 128-width ConvNet 47.6% on Tiny-ImageNet with ResNet18 and 31.4% on the full 224x224 ImageNet-1k with ResNet18 under images per class (IPC) 10 50 and 10 respectively. These results surpass all SOTA methods by margins of 3.9% 6.5% and 10.1% respectively.",True,https://openaccess.thecvf.com/content/CVPR2024/papers/Zhang_TRINS_Towards_Multimodal_Language_Models_that_Can_Read_CVPR_2024_paper.pdf
CVPR-2024-180,cvpr,2024,Towards Surveillance Video-and-Language Understanding: New Dataset Baselines and Challenges,"Tongtong Yuan, Xuange Zhang, Kun Liu, Bo Liu, Chen Chen, Jian Jin, Zhenzhen Jiao",Surveillance videos are important for public security. However current surveillance video tasks mainly focus on classifying and localizing anomalous events. Existing methods are limited to detecting and classifying the predefined events with unsatisfactory semantic understanding although they have obtained considerable performance. To address this issue we propose a new research direction of surveillance video-and-language understanding(VALU) and construct the first multimodal surveillance video dataset. We manually annotate the real-world surveillance dataset UCF-Crime with fine-grained event content and timing. Our newly annotated dataset UCA (UCF-Crime Annotation) contains 23542 sentences with an average length of 20 words and its annotated videos are as long as 110.7 hours. Furthermore we benchmark SOTA models for four multimodal tasks on this newly created dataset which serve as new baselines for surveillance VALU. Through experiments we find that mainstream models used in previously public datasets perform poorly on surveillance video demonstrating new challenges in surveillance VALU. We also conducted experiments on multimodal anomaly detection. These results demonstrate that our multimodal surveillance learning can improve the performance of anomaly detection. All the experiments highlight the necessity of constructing this dataset to advance surveillance AI.,True,https://openaccess.thecvf.com/content/CVPR2024/papers/Fares_Attack_To_Defend_Exploiting_Adversarial_Attacks_for_Detecting_Poisoned_Models_CVPR_2024_paper.pdf
CVPR-2024-1690,cvpr,2024,Towards Real-World HDR Video Reconstruction: A Large-Scale Benchmark Dataset and A Two-Stage Alignment Network,"Yong Shu, Liquan Shen, Xiangyu Hu, Mengyao Li, Zihao Zhou",As an important and practical way to obtain high dynamic range (HDR) video HDR video reconstruction from sequences with alternating exposures is still less explored mainly due to the lack of large-scale real-world datasets. Existing methods are mostly trained on synthetic datasets which perform poorly in real scenes. In this work to facilitate the development of real-world HDR video reconstruction we present Real-HDRV a large-scale real-world benchmark dataset for HDR video reconstruction featuring various scenes diverse motion patterns and high-quality labels. Specifically our dataset contains 500 LDRs-HDRs video pairs comprising about 28000 LDR frames and 4000 HDR labels covering daytime nighttime indoor and outdoor scenes. To our best knowledge our dataset is the largest real-world HDR video reconstruction dataset. Correspondingly we propose an end-to-end network for HDR video reconstruction where a novel two-stage strategy is designed to perform alignment sequentially. Specifically the first stage performs global alignment with the adaptively estimated global offsets reducing the difficulty of subsequent alignment. The second stage implicitly performs local alignment in a coarse-to-fine manner at the feature level using the adaptive separable convolution. Extensive experiments demonstrate that: (1) models trained on our dataset can achieve better performance on real scenes than those trained on synthetic datasets; (2) our method outperforms previous state-of-the-art methods. Our dataset is available at https://github.com/yungsyu99/Real-HDRV.,True,https://openaccess.thecvf.com/content/CVPR2024/papers/Shi_Non-autoregressive_Sequence-to-Sequence_Vision-Language_Models_CVPR_2024_paper.pdf
CVPR-2024-2672,cvpr,2024,CosmicMan: A Text-to-Image Foundation Model for Humans,"Shikai Li, Jianglin Fu, Kaiyuan Liu, Wentao Wang, Kwan-Yee Lin, Wayne Wu",We present CosmicMan a text-to-image foundation model specialized for generating high-fidelity human images. Unlike current general-purpose foundation models that are stuck in the dilemma of inferior quality and text-image misalignment for humans CosmicMan enables generating photo-realistic human images with meticulous appearance reasonable structure and precise text-image alignment with detailed dense descriptions. At the heart of CosmicMan's success are the new reflections and perspectives on data and models: (1) We found that data quality and a scalable data production flow are essential for the final results from trained models. Hence we propose a new data production paradigm Annotate Anyone which serves as a perpetual data flywheel to produce high-quality data with accurate yet cost-effective annotations over time. Based on this we constructed a large-scale dataset CosmicMan-HQ 1.0 with 6 Million high-quality real-world human images in a mean resolution of 1488x1255 and attached with precise text annotations deriving from 115 Million attributes in diverse granularities. (2) We argue that a text-to-image foundation model specialized for humans must be pragmatic - easy to integrate into down-streaming tasks while effective in producing high-quality human images. Hence we propose to model the relationship between dense text descriptions and image pixels in a decomposed manner and present Decomposed-Attention-Refocusing (Daring) training framework. It seamlessly decomposes the cross-attention features in existing text-to-image diffusion model and enforces attention refocusing without adding extra modules. Through Daring we show that explicitly discretizing continuous text space into several basic groups that align with human body structure is the key to tackling the misalignment problem in a breeze. Project page: https://cosmicman-cvpr2024.github.io/.,True,https://openaccess.thecvf.com/content/CVPR2024/papers/Trevithick_What_You_See_is_What_You_GAN_Rendering_Every_Pixel_CVPR_2024_paper.pdf
CVPR-2024-984,cvpr,2024,Tailored Visions: Enhancing Text-to-Image Generation with Personalized Prompt Rewriting,"Zijie Chen, Lichao Zhang, Fangsheng Weng, Lili Pan, Zhenzhong Lan",Despite significant progress in the field it is still challenging to create personalized visual representations that align closely with the desires and preferences of individual users. This process requires users to articulate their ideas in words that are both comprehensible to the models and accurately capture their vision posing difficulties for many users. In this paper we tackle this challenge by leveraging historical user interactions with the system to enhance user prompts. We propose a novel approach that involves rewriting user prompts based on a newly collected large-scale text-to-image dataset with over 300k prompts from 3115 users. Our rewriting model enhances the expressiveness and alignment of user prompts with their intended visual outputs. Experimental results demonstrate the superiority of our methods over baseline approaches as evidenced in our new offline evaluation method and online tests. Our code and dataset are available at https://github.com/zzjchen/Tailored-Visions,True,https://openaccess.thecvf.com/content/CVPR2024/papers/Liang_Generalizable_Face_Landmarking_Guided_by_Conditional_Face_Warping_CVPR_2024_paper.pdf
CVPR-2024-2175,cvpr,2024,Day-Night Cross-domain Vehicle Re-identification,"Hongchao Li, Jingong Chen, Aihua Zheng, Yong Wu, Yonglong Luo",Previous advances in vehicle re-identification (ReID) are mostly reported under favorable lighting conditions while cross-day-and-night performance is neglected which greatly hinders the development of related traffic intelligence applications. This work instead develops a novel Day-Night Dual-domain Modulation (DNDM) vehicle re-identification framework for day-night cross-domain traffic scenarios. Specifically a unique night-domain glare suppression module is provided to attenuate the headlight glare from raw nighttime vehicle images. To enhance vehicle features under low-light environments we propose a dual-domain structure enhancement module in the feature extractor which enhances geometric structures between appearance features. To alleviate day-night domain discrepancies we develop a cross-domain class awareness module that facilitates the interaction between appearance and structure features in both domains. In this work we address the Day-Night cross-domain ReID (DN-ReID) problem and provide a new cross-domain dataset named DN-Wild including day and night images of 2286 identities giving in total 85945 daytime images and 54952 nighttime images. Furthermore we also take into account the matter of balance between day and night samples and provide a dataset called DN-348. Exhaustive experiments demonstrate the robustness of the proposed framework in the DN-ReID problem. The code and benchmark are released at https://github.com/chenjingong/DN-ReID.,True,https://openaccess.thecvf.com/content/CVPR2024/papers/Wang_Self-Supervised_Class-Agnostic_Motion_Prediction_with_Spatial_and_Temporal_Consistency_Regularizations_CVPR_2024_paper.pdf
