id,conference,year,title,authors,abstract,score,url_link
CVPR-2022-428,cvpr,2022,Spatial-Temporal Parallel Transformer for Arm-Hand Dynamic Estimation,"Shuying Liu, Wenbin Wu, Jiaxian Wu, Yue Lin","We propose an approach to estimate arm and hand dynamics from monocular video by utilizing the relationship between arm and hand. Although monocular full human motion capture technologies have made great progress in recent years, recovering accurate and plausible arm twists and hand gestures from in-the-wild videos still remains a challenge. To solve this problem, our solution is proposed based on the fact that arm poses and hand gestures are highly correlated in most real situations. To make best use of arm-hand correlation as well as inter-frame information, we carefully design a Spatial-Temporal Parallel Arm-Hand Motion Transformer (PAHMT) to predict the arm and hand dynamics simultaneously. We also introduce new losses to encourage the estimations to be smooth and accurate. Besides, we collect a motion capture dataset including 200K frames of hand gestures and use this data to train our model. By integrating a 2D hand pose estimation model and a 3D human pose estimation model, the proposed method can produce plausible arm and hand dynamics from monocular video. Extensive evaluations demonstrate that the proposed method has advantages over previous state-of-the-art approaches and shows robustness under various challenging scenarios.",True,https://openaccess.thecvf.com/content/CVPR2022/papers/Li_Decoupling_Makes_Weakly_Supervised_Local_Feature_Better_CVPR_2022_paper.pdf
CVPR-2022-826,cvpr,2022,Fourier Document Restoration for Robust Document Dewarping and Recognition,"Chuhui Xue, Zichen Tian, Fangneng Zhan, Shijian Lu, Song Bai","State-of-the-art document dewarping techniques learn to predict 3-dimensional information of documents which are prone to errors while dealing with documents with irregular distortions or large variations in depth. This paper presents FDRNet, a Fourier Document Restoration Network that can restore documents with different distortions and improve document recognition in a reliable and simpler manner. FDRNet focuses on high-frequency components in the Fourier space that capture most structural information but are largely free of degradation in appearance. It dewarps documents by a flexible Thin-Plate Spline transformation which can handle various deformations effectively without requiring deformation annotations in training. These features allow FDRNet to learn from a small amount of simply labeled training images, and the learned model can dewarp documents with complex geometric distortion and recognize the restored texts accurately. To facilitate document restoration research, we create a benchmark dataset consisting of over one thousand camera documents with different types of geometric and photometric distortion. Extensive experiments show that FDRNet outperforms the state-of-the-art by large margins on both dewarping and text recognition tasks. In addition, FDRNet requires a small amount of simply labeled training data and is easy to deploy.",True,https://openaccess.thecvf.com/content/CVPR2022/papers/Zhao_High-Fidelity_Human_Avatars_From_a_Single_RGB_Camera_CVPR_2022_paper.pdf
CVPR-2022-1562,cvpr,2022,Video Shadow Detection via Spatio-Temporal Interpolation Consistency Training,"Xiao Lu, Yihong Cao, Sheng Liu, Chengjiang Long, Zipei Chen, Xuanyu Zhou, Yimin Yang, Chunxia Xiao","It is challenging to annotate large-scale datasets for supervised video shadow detection methods. Using a model trained on labeled images to the video frames directly may lead to high generalization error and temporal inconsistent results. In this paper, we address these challenges by proposing a Spatio-Temporal Interpolation Consistency Training (STICT) framework to rationally feed the unlabeled video frames together with the labeled images into an image shadow detection network training. Specifically, we propose the Spatial and Temporal ICT, in which we define two new interpolation schemes, i.e., the spatial interpolation and the temporal interpolation. We then derive the spatial and temporal interpolation consistency constraints accordingly for enhancing generalization in the pixel-wise classification task and for encouraging temporal consistent predictions, respectively. In addition, we design a Scale-Aware Network for multi-scale shadow knowledge learning in images, and propose a scale-consistency constraint to minimize the discrepancy among the predictions at different scales. Our proposed approach is extensively validated on the ViSha dataset and a self-annotated dataset. Experimental results show that, even without video labels, our approach is better than most state of the art supervised, semi-supervised or unsupervised image/video shadow detection methods and other methods in related tasks. Code and dataset are available at https://github.com/yihong-97/STICT.",True,https://openaccess.thecvf.com/content/CVPR2022/papers/Xu_Revisiting_AP_Loss_for_Dense_Object_Detection_Adaptive_Ranking_Pair_CVPR_2022_paper.pdf
CVPR-2022-325,cvpr,2022,Weakly-Supervised Metric Learning With Cross-Module Communications for the Classification of Anterior Chamber Angle Images,"Jingqi Huang, Yue Ning, Dong Nie, Linan Guan, Xiping Jia","As the basis for developing glaucoma treatment strategies, Anterior Chamber Angle (ACA) evaluation is usually dependent on experts' judgements. However, experienced ophthalmologists needed for these judgements are not widely available. Thus, computer-aided ACA evaluations become a pressing and efficient solution for this issue. In this paper, we propose a novel end-to-end framework GCNet for automated Glaucoma Classification based on ACA images or other Glaucoma-related medical images. We first collect and label an ACA image dataset with some pixel-level annotations. Next, we introduce a segmentation module and an embedding module to enhance the performance of classifying ACA images. Within GCNet, we design a Cross-Module Aggregation Net (CMANet) which is a weakly-supervised metric learning network to capture contextual information exchanging across these modules. We conduct experiments on the ACA dataset and two public datasets REFUGE and SIGF. Our experimental results demonstrate that GCNet outperforms several state-of-the-art deep models in the tasks of glaucoma medical image classifications. The source code of GCNet can be found at https://github.com/Jingqi-H/GCNet.",True,https://openaccess.thecvf.com/content/CVPR2022/papers/Han_Connecting_the_Complementary-View_Videos_Joint_Camera_Identification_and_Subject_Association_CVPR_2022_paper.pdf
CVPR-2022-1976,cvpr,2022,Knowledge Mining With Scene Text for Fine-Grained Recognition,"Hao Wang, Junchao Liao, Tianheng Cheng, Zewen Gao, Hao Liu, Bo Ren, Xiang Bai, Wenyu Liu","Recently, the semantics of scene text has been proven to be essential in fine-grained image classification. However, the existing methods mainly exploit the literal meaning of scene text for fine-grained recognition, which might be irrelevant when it is not significantly related to objects/scenes. We propose an end-to-end trainable network that mines implicit contextual knowledge behind scene text image and enhance the semantics and correlation to fine-tune the image representation. Unlike the existing methods, our model integrates three modalities: visual feature extraction, text semantics extraction, and correlating background knowledge to fine-grained image classification. Specifically, we employ KnowBert to retrieve relevant knowledge for semantic representation and combine it with image features for fine-grained classification. Experiments on two benchmark datasets, Con-Text, and Drink Bottle, show that our method outperforms the state-of-the-art by 3.72% mAP and 5.39% mAP, respectively. To further validate the effectiveness of the proposed method, we create a new dataset on crowd activity recognition for the evaluation. The source code, new dataset, and pre-trained models of this work will be publicly available.",True,https://openaccess.thecvf.com/content/CVPR2022/papers/Lou_Unsupervised_Vision-Language_Parsing_Seamlessly_Bridging_Visual_Scene_Graphs_With_Language_CVPR_2022_paper.pdf
CVPR-2022-871,cvpr,2022,Scene Representation Transformer: Geometry-Free Novel View Synthesis Through Set-Latent Scene Representations,"Mehdi S. M. Sajjadi, Henning Meyer, Etienne Pot, Urs Bergmann, Klaus Greff, Noha Radwan, Suhani Vora, Mario Lučić, Daniel Duckworth, Alexey Dosovitskiy, Jakob Uszkoreit, Thomas Funkhouser, Andrea Tagliasacchi","A classical problem in computer vision is to infer a 3D scene representation from few images that can be used to render novel views at interactive rates. Previous work focuses on reconstructing pre-defined 3D representations, e.g. textured meshes, or implicit representations, e.g. radiance fields, and often requires input images with precise camera poses and long processing times for each novel scene. In this work, we propose the Scene Representation Transformer (SRT), a method which processes posed or unposed RGB images of a new area, infers a ""set-latent scene representation"", and synthesises novel views, all in a single feed-forward pass. To calculate the scene representation, we propose a generalization of the Vision Transformer to sets of images, enabling global information integration, and hence 3D reasoning. An efficient decoder transformer parameterizes the light field by attending into the scene representation to render novel views. Learning is supervised end-to-end by minimizing a novel-view reconstruction error. We show that this method outperforms recent baselines in terms of PSNR and speed on synthetic datasets, including a new dataset created for the paper. Further, we demonstrate that SRT scales to support interactive visualization and semantic segmentation of real-world outdoor environments using Street View imagery.",True,https://openaccess.thecvf.com/content/CVPR2022/papers/Chuah_ITSA_An_Information-Theoretic_Approach_to_Automatic_Shortcut_Avoidance_and_Domain_CVPR_2022_paper.pdf
CVPR-2022-1895,cvpr,2022,UniCoRN: A Unified Conditional Image Repainting Network,"Jimeng Sun, Shuchen Weng, Zheng Chang, Si Li, Boxin Shi","Conditional image repainting (CIR) is an advanced image editing task, which requires the model to generate visual content in user-specified regions conditioned on multiple cross-modality constraints, and composite the visual content with the provided background seamlessly. Existing methods based on two-phase architecture design assume dependency between phases and cause color-image incongruity. To solve these problems, we propose a novel Unified Conditional image Repainting Network (UniCoRN). We break the two-phase assumption in CIR task by constructing the interaction and dependency relationship between background and other conditions. We further introduce the hierarchical structure into cross-modality similarity model to capture feature patterns at different levels and bridge the gap between visual content and color condition. A new LANDSCAPE-CIR dataset is collected and annotated to expand the application scenarios of the CIR task. Experiments show that UniCoRN achieves higher synthetic quality, better condition consistency, and more realistic compositing effect.",True,https://openaccess.thecvf.com/content/CVPR2022/papers/Kittenplon_Towards_Weakly-Supervised_Text_Spotting_Using_a_Multi-Task_Transformer_CVPR_2022_paper.pdf
CVPR-2022-1533,cvpr,2022,Unsupervised Vision-Language Parsing: Seamlessly Bridging Visual Scene Graphs With Language Structures via Dependency Relationships,"Chao Lou, Wenjuan Han, Yuhuan Lin, Zilong Zheng","Understanding realistic visual scene images together with language descriptions is a fundamental task towards generic visual understanding. Previous works have shown compelling comprehensive results by building hierarchical structures for visual scenes (e.g., scene graphs) and natural languages (e.g., dependency trees), individually. However, how to construct a joint vision-language (VL) structure has barely been investigated. More challenging but worthwhile, we introduce a new task that targets on inducing such a joint VL structure in an unsupervised manner. Our goal is to bridge the visual scene graphs and linguistic dependency trees seamlessly. Due to the lack of VL structural data, we start by building a new dataset VLParse. Rather than using labor-intensive labeling from scratch, we propose an automatic alignment procedure to produce coarse structures followed by human refinement to produce high-quality ones. Moreover, we benchmark our dataset by proposing a contrastive learning (CL)-based framework VLGAE, short for Vision-Language Graph Autoencoder. Our model obtains superior performance on two derived tasks, i.e., language grammar induction and VL phrase grounding. Ablations show the effectiveness of both visual cues and dependency relationships on fine-grained VL structure construction.",True,https://openaccess.thecvf.com/content/CVPR2022/papers/Wang_Remember_the_Difference_Cross-Domain_Few-Shot_Semantic_Segmentation_via_Meta-Memory_Transfer_CVPR_2022_paper.pdf
CVPR-2022-1148,cvpr,2022,WebQA: Multihop and Multimodal QA,"Yingshan Chang, Mridu Narang, Hisami Suzuki, Guihong Cao, Jianfeng Gao, Yonatan Bisk","Scaling Visual Question Answering (VQA) to the open-domain and multi-hop nature of web searches, requires fundamental advances in visual representation learning, knowledge aggregation, and language generation. In this work, we introduce WebQA, a challenging new benchmark that proves difficult for large-scale state-of-the-art models which lack language groundable visual representations for novel objects and the ability to reason, yet trivial for humans. WebQA mirrors the way humans use the web: 1) Ask a question, 2) Choose sources to aggregate, and 3) Produce a fluent language response. This is the behavior we should be expecting from IoT devices and digital assistants. Existing work prefers to assume that a model can either reason about knowledge in images or in text. WebQA includes a secondary text-only QA task to ensure improved visual performance does not come at the cost of language understanding. Our challenge for the community is to create unified multimodal reasoning models that answer questions regardless of the source modality, moving us closer to digital assistants that not only query language knowledge, but also the richer visual online world.",True,https://openaccess.thecvf.com/content/CVPR2022/papers/Park_MatteFormer_Transformer-Based_Image_Matting_via_Prior-Tokens_CVPR_2022_paper.pdf
CVPR-2022-1023,cvpr,2022,Primitive3D: 3D Object Dataset Synthesis From Randomly Assembled Primitives,"Xinke Li, Henghui Ding, Zekun Tong, Yuwei Wu, Yeow Meng Chee","Numerous advancements of deep learning can be attributed to access to large-scale and well-annotated datasets. However, such a dataset is prohibitively expensive in 3D computer vision due to the substantial collection cost. To alleviate this issue, we propose a cost-effective method for automatically generating a large amount of 3D objects with annotations. In particular, we synthesize objects simply by assembling multiple random primitives. These objects are thus auto-annotated with part-based labels originating from primitives. This allows us to perform multi-task learning by combining the supervised segmentation with unsupervised reconstruction. Considering the large overhead of learning on the generated dataset, we further propose a dataset distillation strategy to remove redundant samples regarding a target dataset. We conduct extensive experiments for the downstream tasks of 3D object classification. The results indicate that our dataset, together with multi-task pretraining on its annotations, achieves the best performance compared to other commonly used datasets. Further study suggests that our strategy can improve the model performance by pretraining and fine-tuning scheme, especially for a dataset with a small scale. In addition, pretraining with the proposed dataset distillation method can save 86% of the pretraining time with negligible performance degradation. We expect that our attempt provides a new data-centric perspective for training 3D deep models.",True,https://openaccess.thecvf.com/content/CVPR2022/papers/Liu_Learning_Non-Target_Knowledge_for_Few-Shot_Semantic_Segmentation_CVPR_2022_paper.pdf
CVPR-2022-1545,cvpr,2022,SoftCollage: A Differentiable Probabilistic Tree Generator for Image Collage,"Jiahao Yu, Li Chen, Mingrui Zhang, Mading Li","Image collage task aims to create an informative and visual-aesthetic visual summarization for an image collection. While several recent works exploit tree-based algorithm to preserve image content better, all of them resort to hand-crafted adjustment rules to optimize the collage tree structure, leading to the failure of fully exploring the structure space of collage tree. Our key idea is to soften the discrete tree structure space into a continuous probability space. We propose SoftCollage, a novel method that employs a neural-based differentiable probabilistic tree generator to produce the probability distribution of correlation-preserving collage tree conditioned on deep image feature, aspect ratio and canvas size. The differentiable characteristic allows us to formulate the tree-based collage generation as a differentiable process and directly exploit gradient to optimize the collage layout in the level of probability space in an end-to-end manner. To facilitate image collage research, we propose AIC, a large-scale public-available annotated dataset for image collage evaluation. Extensive experiments on the introduced dataset demonstrate the superior performance of the proposed method. Data and codes are available at https://github.com/ChineseYjh/SoftCollage.",True,https://openaccess.thecvf.com/content/CVPR2022/papers/Wang_Rethinking_Bayesian_Deep_Learning_Methods_for_Semi-Supervised_Volumetric_Medical_Image_CVPR_2022_paper.pdf
CVPR-2022-635,cvpr,2022,Continual Predictive Learning From Videos,"Geng Chen, Wendong Zhang, Han Lu, Siyu Gao, Yunbo Wang, Mingsheng Long, Xiaokang Yang","Predictive learning ideally builds the world model of physical processes in one or more given environments. Typical setups assume that we can collect data from all environments at all times. In practice, however, different prediction tasks may arrive sequentially so that the environments may change persistently throughout the training procedure. Can we develop predictive learning algorithms that can deal with more realistic, non-stationary physical environments? In this paper, we study a new continual learning problem in the context of video prediction, and observe that most existing methods suffer from severe catastrophic forgetting in this setup. To tackle this problem, we propose the continual predictive learning (CPL) approach, which learns a mixture world model via predictive experience replay and performs test-time adaptation with non-parametric task inference. We construct two new benchmarks based on RoboNet and KTH, in which different tasks correspond to different physical robotic environments or human actions. Our approach is shown to effectively mitigate forgetting and remarkably outperform the naive combinations of previous art in video prediction and continual learning.",True,https://openaccess.thecvf.com/content/CVPR2022/papers/Huang_Exposure_Normalization_and_Compensation_for_Multiple-Exposure_Correction_CVPR_2022_paper.pdf
CVPR-2022-1417,cvpr,2022,3D-VField: Adversarial Augmentation of Point Clouds for Domain Generalization in 3D Object Detection,"Alexander Lehner, Stefano Gasperini, Alvaro Marcos-Ramiro, Michael Schmidt, Mohammad-Ali Nikouei Mahani, Nassir Navab, Benjamin Busam, Federico Tombari","As 3D object detection on point clouds relies on the geometrical relationships between the points, non-standard object shapes can hinder a method's detection capability. However, in safety-critical settings, robustness to out-of-domain and long-tail samples is fundamental to circumvent dangerous issues, such as the misdetection of damaged or rare cars. In this work, we substantially improve the generalization of 3D object detectors to out-of-domain data by deforming point clouds during training. We achieve this with 3D-VField: a novel data augmentation method that plausibly deforms objects via vector fields learned in an adversarial fashion. Our approach constrains 3D points to slide along their sensor view rays while neither adding nor removing any of them. The obtained vectors are transferable, sample-independent and preserve shape and occlusions. Despite training only on a standard dataset, such as KITTI, augmenting with our vector fields significantly improves the generalization to differently shaped objects and scenes. Towards this end, we propose and share CrashD: a synthetic dataset of realistic damaged and rare cars, with a variety of crash scenarios. Extensive experiments on KITTI, Waymo, our CrashD and SUN RGB-D show the generalizability of our techniques to out-of-domain data, different models and sensors, namely LiDAR and ToF cameras, for both indoor and outdoor scenes. Our CrashD dataset is available at https://crashd-cars.github.io.",True,https://openaccess.thecvf.com/content/CVPR2022/papers/Hu_Point_Density-Aware_Voxels_for_LiDAR_3D_Object_Detection_CVPR_2022_paper.pdf
CVPR-2022-1429,cvpr,2022,WALT: Watch and Learn 2D Amodal Representation From Time-Lapse Imagery,"N. Dinesh Reddy, Robert Tamburo, Srinivasa G. Narasimhan","Current methods for object detection, segmentation, and tracking fail in the presence of severe occlusions in busy urban environments. Labeled real data of occlusions is scarce (even in large datasets) and synthetic data leaves a domain gap, making it hard to explicitly model and learn occlusions. In this work, we present the best of both the real and synthetic worlds for automatic occlusion supervision using a large readily available source of data: time-lapse imagery from stationary webcams observing street intersections over weeks, months, or even years. We introduce a new dataset, Watch and Learn Time-lapse (WALT), consisting of 12 (4K and 1080p) cameras capturing urban environments over a year. We exploit this real data in a novel way to automatically mine a large set of unoccluded objects and then composite them in the same views to generate occlusions. This longitudinal self-supervision is strong enough for an amodal network to learn object-occluder-occluded layer representations. We show how to speed up the discovery of unoccluded objects and relate the confidence in this discovery to the rate and accuracy of training occluded objects. After watching and automatically learning for several days, this approach shows significant performance improvement in detecting and segmenting occluded people and vehicles, over human-supervised amodal approaches.",True,https://openaccess.thecvf.com/content/CVPR2022/papers/Kim_Polymorphic-GAN_Generating_Aligned_Samples_Across_Multiple_Domains_With_Learned_Morph_CVPR_2022_paper.pdf
CVPR-2022-1753,cvpr,2022,ETHSeg: An Amodel Instance Segmentation Network and a Real-World Dataset for X-Ray Waste Inspection,"Lingteng Qiu, Zhangyang Xiong, Xuhao Wang, Kenkun Liu, Yihan Li, Guanying Chen, Xiaoguang Han, Shuguang Cui","Waste inspection for packaged waste is an important step in the pipeline of waste disposal. Previous methods either rely on manual visual checking or RGB image-based inspection algorithm, requiring costly preparation procedures (e.g., open the bag and spread the waste items). Moreover, occluded items are very likely to be left out. Inspired by the fact that X-ray has a strong penetrating power to see through the bag and overlapping objects, we propose to perform waste inspection efficiently using X-ray images without the need to open the bag. We introduce a novel problem of instance-level waste segmentation in X-ray image for intelligent waste inspection, and contribute a real dataset consisting of 5,038 X-ray images (totally 30,881 waste items) with high-quality annotations (i.e., waste categories, object boxes, and instance-level masks) as a benchmark for this problem. As existing segmentation methods are mainly designed for natural images and cannot take advantage of the characteristics of X-ray waste images (e.g., heavy occlusions and penetration effect), we propose a new instance segmentation method to explicitly take these image characteristics into account. Specifically, our method adopts an easy-to-hard disassembling strategy to use high confidence predictions to guide the segmentation of highly overlapped objects, and a global structure guidance module to better capture the complex contour information caused by the penetration effect. Extensive experiments demonstrate the effectiveness of the proposed method. Our dataset is released at WIXRayNet.",True,https://openaccess.thecvf.com/content/CVPR2022/papers/Ryder_Split_Hierarchical_Variational_Compression_CVPR_2022_paper.pdf
