id,conference,year,title,authors,abstract,score,url_link
CVPR-2022-965,cvpr,2022,CrossLoc: Scalable Aerial Localization Assisted by Multimodal Synthetic Data,"Qi Yan, Jianhao Zheng, Simon Reding, Shanci Li, Iordan Doytchinov","We present a visual localization system that learns to estimate camera poses in the real world with the help of synthetic data. Despite significant progress in recent years, most learning-based approaches to visual localization target at a single domain and require a dense database of geo-tagged images to function well. To mitigate the data scarcity issue and improve the scalability of the neural localization models, we introduce TOPO-DataGen, a versatile synthetic data generation tool that traverses smoothly between the real and virtual world, hinged on the geographic camera viewpoint. New large-scale sim-to-real benchmark datasets are proposed to showcase and evaluate the utility of the said synthetic data. Our experiments reveal that synthetic data generically enhances the neural network performance on real data. Furthermore, we introduce CrossLoc, a cross-modal visual representation learning approach to pose estimation that makes full use of the scene coordinate ground truth via self-supervision. Without any extra data, CrossLoc significantly outperforms the state-of-the-art methods and achieves substantially higher real-data sample efficiency. Our code and datasets are all available at crossloc.github.io.",True,https://openaccess.thecvf.com/content/CVPR2022/papers/Guo_LAR-SR_A_Local_Autoregressive_Model_for_Image_Super-Resolution_CVPR_2022_paper.pdf
CVPR-2022-1685,cvpr,2022,JoinABLe: Learning Bottom-Up Assembly of Parametric CAD Joints,"Karl D.D. Willis, Pradeep Kumar Jayaraman, Hang Chu, Yunsheng Tian, Yifei Li, Daniele Grandi, Aditya Sanghi, Linh Tran, Joseph G. Lambourne, Armando Solar-Lezama, Wojciech Matusik","Physical products are often complex assemblies combining a multitude of 3D parts modeled in computer-aided design (CAD) software. CAD designers build up these assemblies by aligning individual parts to one another using constraints called joints. In this paper we introduce JoinABLe, a learning-based method that assembles parts together to form joints. JoinABLe uses the weak supervision available in standard parametric CAD files without the help of object class labels or human guidance. Our results show that by making network predictions over a graph representation of solid models we can outperform multiple baseline methods with an accuracy (79.53%) that approaches human performance (80%). Finally, to support future research we release the AssemblyJoint dataset, containing assemblies with rich information on joints, contact surfaces, holes, and the underlying assembly graph structure.",True,https://openaccess.thecvf.com/content/CVPR2022/papers/Shen_Semi-Weakly-Supervised_Learning_of_Complex_Actions_From_Instructional_Task_Videos_CVPR_2022_paper.pdf
CVPR-2022-151,cvpr,2022,Real-Time Hyperspectral Imaging in Hardware via Trained Metasurface Encoders,"Maksim Makarenko, Arturo Burguete-Lopez, Qizhou Wang, Fedor Getman, Silvio Giancola, Bernard Ghanem, Andrea Fratalocchi","Hyperspectral imaging has attracted significant attention to identify spectral signatures for image classification and automated pattern recognition in computer vision. State-of-the-art implementations of snapshot hyperspectral imaging rely on bulky, non-integrated, and expensive optical elements, including lenses, spectrometers, and filters. These macroscopic components do not allow fast data processing for, e.g., real-time and high-resolution videos. This work introduces Hyplex, a new integrated architecture addressing the limitations discussed above. Hyplex is a CMOS-compatible, fast hyperspectral camera that replaces bulk optics with nanoscale metasurfaces inversely designed through artificial intelligence. Hyplex does not require spectrometers but makes use of conventional monochrome cameras, opening up real-time and high-resolution hyperspectral imaging at inexpensive costs. Hyplex exploits a model-driven optimization, which connects the physical metasurfaces layer with modern visual computing approaches based on end-to-end training. We design and implement a prototype version of Hyplex and compare its performance against the state-of-the-art for typical imaging tasks such as spectral reconstruction and semantic segmentation. In all benchmarks, Hyplex reports the smallest reconstruction error. In addition, to the best of the authors' knowledge, we created FVgNET, the largest publicly available labeled hyperspectral dataset for semantic segmentation tasks.",True,https://openaccess.thecvf.com/content/CVPR2022/papers/Tseng_Automatic_Synthesis_of_Diverse_Weak_Supervision_Sources_for_Behavior_Analysis_CVPR_2022_paper.pdf
CVPR-2022-1089,cvpr,2022,LD-ConGR: A Large RGB-D Video Dataset for Long-Distance Continuous Gesture Recognition,"Dan Liu, Libo Zhang, Yanjun Wu","Gesture recognition plays an important role in natural human-computer interaction and sign language recognition. Existing research on gesture recognition is limited to close-range interaction such as vehicle gesture control and face-to-face communication. To apply gesture recognition to long-distance interactive scenes such as meetings and smart homes, a large RGB-D video dataset LD-ConGR is established in this paper. LD-ConGR is distinguished from existing gesture datasets by its long-distance gesture collection, fine-grained annotations, and high video quality. Specifically, 1) the farthest gesture provided by the LD-ConGR is captured 4m away from the camera while existing gesture datasets collect gestures within 1m from the camera; 2) besides the gesture category, the temporal segmentation of gestures and hand location are also annotated in LD-ConGR; 3) videos are captured at high resolution (1280x720 for color streams and 640x576 for depth streams) and high frame rate (30 fps). On top of the LD-ConGR, a series of experimental and studies are conducted, and the proposed gesture region estimation and key frame sampling strategies are demonstrated to be effective in dealing with long-distance gesture recognition and the uncertainty of gesture duration. The dataset and experimental results presented in this paper are expected to boost the research of long-distance gesture recognition. The dataset is available at https://github.com/Diananini/LD-ConGR-CVPR2022.",True,https://openaccess.thecvf.com/content/CVPR2022/papers/Shim_Local_Attention_Pyramid_for_Scene_Image_Generation_CVPR_2022_paper.pdf
CVPR-2022-971,cvpr,2022,MLSLT: Towards Multilingual Sign Language Translation,"Aoxiong Yin, Zhou Zhao, Weike Jin, Meng Zhang, Xingshan Zeng, Xiaofei He","Most of the research to date focuses on bilingual sign language translation (BSLT). However, such models are inefficient in building multilingual sign language translation systems. To solve this problem, we introduce the multilingual sign language translation (MSLT) task. It aims to use a single model to complete the translation between multiple sign languages and spoken languages. Then, we propose MLSLT, the first MSLT model, which contains two novel dynamic routing mechanisms for controlling the degree of parameter sharing between different languages. Intra-layer language-specific routing controls the proportion of data flowing through shared parameters and language-specific parameters from the token level through a soft gate within the layer, and inter-layer language-specific routing controls and learns the data flow path of different languages at the language level through a soft gate between layers. In order to evaluate the performance of MLSLT, we collect the first publicly available multilingual sign language understanding dataset, Spreadthesign-Ten (SP-10), which contains up to 100 language pairs, e.g., CSL->en, GSG->zh. Experimental results show that the average performance of MLSLT outperforms the baseline MSLT model and the combination of multiple BSLT models in many cases. In addition, we also explore zero-shot translation in sign language and find that our model can achieve comparable performance to the supervised BSLT model on some language pairs. Dataset and more details are at https://mlslt.github.io/.",True,https://openaccess.thecvf.com/content/CVPR2022/papers/Liu_LD-ConGR_A_Large_RGB-D_Video_Dataset_for_Long-Distance_Continuous_Gesture_CVPR_2022_paper.pdf
CVPR-2022-1273,cvpr,2022,Stable Long-Term Recurrent Video Super-Resolution,"Benjamin Naoto Chiche, Arnaud Woiselle, Joana Frontera-Pons, Jean-Luc Starck","Recurrent models have gained popularity in deep learning (DL) based video super-resolution (VSR), due to their increased computational efficiency, temporal receptive field and temporal consistency compared to sliding-window based models. However, when inferring on long video sequences presenting low motion (i.e. in which some parts of the scene barely move), recurrent models diverge through recurrent processing, generating high frequency artifacts. To the best of our knowledge, no study about VSR pointed out this instability problem, which can be critical for some real-world applications. Video surveillance is a typical example where such artifacts would occur, as both the camera and the scene stay static for a long time. In this work, we expose instabilities of existing recurrent VSR networks on long sequences with low motion. We demonstrate it on a new long sequence dataset Quasi-Static Video Set, that we have created. Finally, we introduce a new framework of recurrent VSR networks that is both stable and competitive, based on Lipschitz stability theory. We propose a new recurrent VSR network, coined Middle Recurrent Video Super-Resolution (MRVSR), based on this framework. We empirically show its competitive performance on long sequences with low motion.",True,https://openaccess.thecvf.com/content/CVPR2022/papers/Chen_Neural_Shape_Mating_Self-Supervised_Object_Assembly_With_Adversarial_Shape_Priors_CVPR_2022_paper.pdf
CVPR-2022-1843,cvpr,2022,The DEVIL Is in the Details: A Diagnostic Evaluation Benchmark for Video Inpainting,"Ryan Szeto, Jason J. Corso","Quantitative evaluation has increased dramatically among recent video inpainting work, but the video and mask content used to gauge performance has received relatively little attention. Although attributes such as camera and background scene motion inherently change the difficulty of the task and affect methods differently, existing evaluation schemes fail to control for them, thereby providing minimal insight into inpainting failure modes. To address this gap, we propose the Diagnostic Evaluation of Video Inpainting on Landscapes (DEVIL) benchmark, which consists of two contributions: (i) a novel dataset of videos and masks labeled according to several key inpainting failure modes, and (ii) an evaluation scheme that samples slices of the dataset characterized by a fixed content attribute, and scores performance on each slice according to reconstruction, realism, and temporal consistency quality. By revealing systematic changes in performance induced by particular characteristics of the input content, our challenging benchmark enables more insightful analysis into video inpainting methods and serves as an invaluable diagnostic tool for the field. Our code and data are available at github.com/MichiganCOG/devil.",True,https://openaccess.thecvf.com/content/CVPR2022/papers/Chen_The_Principle_of_Diversity_Training_Stronger_Vision_Transformers_Calls_for_CVPR_2022_paper.pdf
CVPR-2022-1122,cvpr,2022,DAIR-V2X: A Large-Scale Dataset for Vehicle-Infrastructure Cooperative 3D Object Detection,"Haibao Yu, Yizhen Luo, Mao Shu, Yiyi Huo, Zebang Yang, Yifeng Shi, Zhenglong Guo, Hanyu Li, Xing Hu, Jirui Yuan, Zaiqing Nie","Autonomous driving faces great safety challenges for a lack of global perspective and the limitation of long-range perception capabilities. It has been widely agreed that vehicle-infrastructure cooperation is required to achieve Level 5 autonomy. However, there is still NO dataset from real scenarios available for computer vision researchers to work on vehicle-infrastructure cooperation-related problems. To accelerate computer vision research and innovation for Vehicle-Infrastructure Cooperative Autonomous Driving (VICAD), we release DAIR-V2X Dataset, which is the first large-scale, multi-modal, multi-view dataset from real scenarios for VICAD. DAIR-V2X comprises 71254 LiDAR frames and 71254 Camera frames, and all frames are captured from real scenes with 3D annotations. The Vehicle-Infrastructure Cooperative 3D Object Detection problem (VIC3D) is introduced, formulating the problem of collaboratively locating and identifying 3D objects using sensory input from both vehicles and infrastructure. In addition to solving traditional 3D object detection problems, the solution of VIC3D needs to consider the time asynchrony problem between vehicle and infrastructure sensors and the data transmission cost between them. Furthermore, we propose Time Compensation Late Fusion (TCLF), a late fusion framework for the VIC3D task as a benchmark based on DAIR-V2X. Find data, code, and more up-to-date information at \\\\href https://thudair.baai.ac.cn/index  https://thudair.baai.ac.cn/index  and \\\\href https://github.com/AIR-THU/DAIR-V2X  https://github.com/AIR-THU/DAIR-V2X .",True,https://openaccess.thecvf.com/content/CVPR2022/papers/Xie_MNSRNet_Multimodal_Transformer_Network_for_3D_Surface_Super-Resolution_CVPR_2022_paper.pdf
CVPR-2022-202,cvpr,2022,It Is Okay To Not Be Okay: Overcoming Emotional Bias in Affective Image Captioning by Contrastive Data Collection,"Youssef Mohamed, Faizan Farooq Khan, Kilichbek Haydarov, Mohamed Elhoseiny","Datasets that capture the connection between vision, language, and affection are limited, causing a lack of understanding of the emotional aspect of human intelligence. As a step in this direction, the ArtEmis dataset was recently introduced as a large-scale dataset of emotional reactions to images along with language explanations of these chosen emotions. We observed a significant emotional bias towards instance-rich emotions, making trained neural speakers less accurate in describing under-represented emotions. We show that collecting new data, in the same way, is not effective in mitigating this emotional bias. To remedy this problem, we propose a contrastive data collection approach to balance ArtEmis with a new complementary dataset such that a pair of similar images have contrasting emotions (one positive and one negative). We collected 260,533 instances using the proposed method, we combine them with ArtEmis, creating a second iteration of the dataset. The new combined dataset, dubbed ArtEmis v2.0, has a balanced distribution of emotions with explanations revealing more fine details in the associated painting. Our experiments show that neural speakers trained on the new dataset improve CIDEr and METEOR evaluation metrics by 20% and 7%, respectively, compared to the biased dataset. Finally, we also show that the performance per emotion of neural speakers is improved across all the emotion categories, significantly on under-represented emotions. The collected dataset and code are available at https://artemisdataset-v2.org.",True,https://openaccess.thecvf.com/content/CVPR2022/papers/Ianina_BodyMap_Learning_Full-Body_Dense_Correspondence_Map_CVPR_2022_paper.pdf
CVPR-2022-545,cvpr,2022,Learning Affordance Grounding From Exocentric Images,"Hongchen Luo, Wei Zhai, Jing Zhang, Yang Cao, Dacheng Tao","Affordance grounding, a task to ground (i.e., localize) action possibility region in objects, which faces the challenge of establishing an explicit link with object parts due to the diversity of interactive affordance. Human has the ability that transform the various exocentric interactions to invariant egocentric affordance so as to counter the impact of interactive diversity. To empower an agent with such ability, this paper proposes a task of affordance grounding from exocentric view, i.e., given exocentric human-object interaction and egocentric object images, learning the affordance knowledge of the object and transferring it to the egocentric image using only the affordance label as supervision. To this end, we devise a cross-view knowledge transfer framework that extracts affordance-specific features from exocentric interactions and enhances the perception of affordance regions by preserving affordance correlation. Specifically, an Affordance Invariance Mining module is devised to extract specific clues by minimizing the intra-class differences originated from interaction habits in exocentric images. Besides, an Affordance Co-relation Preserving strategy is presented to perceive and localize affordance by aligning the co-relation matrix of predicted results between the two views. Particularly, an affordance grounding dataset named AGD20K is constructed by collecting and labeling over 20K images from 36 affordance categories. Experimental results demonstrate that our method outperforms the representative models in terms of objective metrics and visual quality. Code: github.com/lhc1224/Cross-View-AG.",True,https://openaccess.thecvf.com/content/CVPR2022/papers/Toker_DynamicEarthNet_Daily_Multi-Spectral_Satellite_Dataset_for_Semantic_Change_Segmentation_CVPR_2022_paper.pdf
CVPR-2022-1026,cvpr,2022,Dynamic 3D Gaze From Afar: Deep Gaze Estimation From Temporal Eye-Head-Body Coordination,"Soma Nonaka, Shohei Nobuhara, Ko Nishino","We introduce a novel method and dataset for 3D gaze estimation of a freely moving person from a distance, typically in surveillance views. Eyes cannot be clearly seen in such cases due to occlusion and lacking resolution. Existing gaze estimation methods suffer or fall back to approximating gaze with head pose as they primarily rely on clear, close-up views of the eyes. Our key idea is to instead leverage the intrinsic gaze, head, and body coordination of people. Our method formulates gaze estimation as Bayesian prediction given temporal estimates of head and body orientations which can be reliably estimated from a far. We model the head and body orientation likelihoods and the conditional prior of gaze direction on those with separate neural networks which are then cascaded to output the 3D gaze direction. We introduce an extensive new dataset that consists of surveillance videos annotated with 3D gaze directions captured in 5 indoor and outdoor scenes. Experimental results on this and other datasets validate the accuracy of our method and demonstrate that gaze can be accurately estimated from a typical surveillance distance even when the person's face is not visible to the camera.",True,https://openaccess.thecvf.com/content/CVPR2022/papers/Peng_Learning_Optimal_K-Space_Acquisition_and_Reconstruction_Using_Physics-Informed_Neural_Networks_CVPR_2022_paper.pdf
CVPR-2022-673,cvpr,2022,Whose Hands Are These? Hand Detection and Hand-Body Association in the Wild,"Supreeth Narasimhaswamy, Thanh Nguyen, Mingzhen Huang, Minh Hoai","We study a new problem of detecting hands and finding the location of the corresponding person for each detected hand. This task is helpful for many downstream tasks such as hand tracking and hand contact estimation. Associating hands with people is challenging in unconstrained conditions since multiple people can be present in the scene with varying overlaps and occlusions. We propose a novel end-to-end trainable convolutional network that can jointly detect hands and the body location for the corresponding person. Our method first detects a set of hands and bodies and uses a novel Hand-Body Association Network to predict association scores between them. We use these association scores to find the body location for each detected hand. We also introduce a new challenging dataset called BodyHands containing unconstrained images with hand and their corresponding body locations annotations. We conduct extensive experiments on BodyHands and another public dataset to show the effectiveness of our method. Finally, we demonstrate the benefits of hand-body association in two critical applications: hand tracking and hand contact estimation. Our experiments show that hand tracking and hand contact estimation methods can be improved significantly by reasoning about the hand-body association.",True,https://openaccess.thecvf.com/content/CVPR2022/papers/Xiao_Few_Shot_Generative_Model_Adaption_via_Relaxed_Spatial_Structural_Alignment_CVPR_2022_paper.pdf
CVPR-2022-638,cvpr,2022,Multi-Grained Spatio-Temporal Features Perceived Network for Event-Based Lip-Reading,"Ganchao Tan, Yang Wang, Han Han, Yang Cao, Feng Wu, Zheng-Jun Zha","Automatic lip-reading (ALR) aims to recognize words using visual information from the speaker's lip movements. In this work, we introduce a novel type of sensing device, event cameras, for the task of ALR. Event cameras have both technical and application advantages over conventional cameras for the ALR task because they have higher temporal resolution, less redundant visual information, and lower power consumption. To recognize words from the event data, we propose a novel Multi-grained Spatio-Temporal Features Perceived Network (MSTP) to perceive fine-grained spatio-temporal features from microsecond time-resolved event data. Specifically, a multi-branch network architecture is designed, in which different grained spatio-temporal features are learned by operating at different frame rates. The branch operating on the low frame rate can perceive spatial complete but temporal coarse features. While the branch operating on the high frame rate can perceive spatial coarse but temporal refinement features. And a message flow module is devised to integrate the features from different branches, leading to perceiving more discriminative spatio-temporal features. In addition, we present the first event-based lip-reading dataset (DVS-Lip) captured by the event camera. Experimental results demonstrated the superiority of the proposed model compared to the state-of-the-art event-based action recognition models and video-based lip-reading models.",True,https://openaccess.thecvf.com/content/CVPR2022/papers/Dhar_EyePAD_A_Distillation-Based_Approach_for_Joint_Eye_Authentication_and_Presentation_CVPR_2022_paper.pdf
CVPR-2022-1487,cvpr,2022,Amodal Panoptic Segmentation,"Rohit Mohan, Abhinav Valada","Humans have the remarkable ability to perceive objects as a whole, even when parts of them are occluded. This ability of amodal perception forms the basis of our perceptual and cognitive understanding of our world. To enable robots to reason with this capability, we formulate and propose a novel task that we name amodal panoptic segmentation. The goal of this task is to simultaneously predict the pixel-wise semantic segmentation labels of the visible regions of stuff classes and the instance segmentation labels of both the visible and occluded regions of thing classes. To facilitate research on this new task, we extend two established benchmark datasets with pixel-level amodal panoptic segmentation labels that we make publicly available as KITTI-360-APS and BDD100K-APS. We present several strong baselines, along with the amodal panoptic quality (APQ) and amodal parsing coverage (APC) metrics to quantify the performance in an interpretable manner. Furthermore, we propose the novel amodal panoptic segmentation network (APSNet), as a first step towards addressing this task by explicitly modeling the complex relationships between the occluders and occludes. Extensive experimental evaluations demonstrate that APSNet achieves state-of-the-art performance on both benchmarks and more importantly exemplifies the utility of amodal recognition. The datasets are available at http://amodal-panoptic.cs.uni-freiburg.de",True,https://openaccess.thecvf.com/content/CVPR2022/papers/Xu_RFNet_Unsupervised_Network_for_Mutually_Reinforcing_Multi-Modal_Image_Registration_and_CVPR_2022_paper.pdf
